{
  "trash_id": "0d7824bb924701997f874e7ff7d4844a",
  "trash_scores": {
    "default": 5000
  },
  "name": "TrueHD ATMOS",
  "includeCustomFormatWhenRenaming": false,
  "specifications": [
    {
      "name": "TrueHD",
      "implementation": "ReleaseTitleSpecification",
      "negate": false,
      "required": true,
      "fields": {
        "value": "True[ .-]?HD"
      }
    },
    {
      "name": "ATMOS",
      "implementation": "ReleaseTitleSpecification",
      "negate": false,
      "required": true,
      "fields": {
        "value": "\\bATMOS(\\b|\\d)"
      }
    },
    {
      "name": "Not Basic Dolby Digital",
      "implementation": "ReleaseTitleSpecification",
      "negate": true,
      "required": true,
      "fields": {
        "value": "\\bDD[^a-z+]|(?<!e-)\\b(ac-?3)\\b"
      }
    },
    {
      "name": "Not Dolby Digital Plus",
      "implementation": "ReleaseTitleSpecification",
      "negate": true,
      "required": true,
      "fields": {
        "value": "\\bDD[P+]|\\b(e[-_. ]?ac-?3)\\b"
      }
    },
    {
      "name": "Not DTS",
      "implementation": "ReleaseTitleSpecification",
      "negate": true,
      "required": true,
      "fields": {
        "value": "\\bDTS(\\b|\\d)"
      }
    },
    {
      "name": "Not DTS X",
      "implementation": "ReleaseTitleSpecification",
      "negate": true,
      "required": true,
      "fields": {
        "value": "\\b(dts[-_.: ]?x7?)\\b(?![-_. ]?(26[456]))"
      }
    },
    {
      "name": "Not FLAC",
      "implementation": "ReleaseTitleSpecification",
      "negate": true,
      "required": true,
      "fields": {
        "value": "\\bFLAC(\\b|\\d)"
      }
    }
  ]
}
