{
  "trash_id": "4232a509ce60c4e208d13825b7c06264",
  "trash_scores": {
    "default": 3000
  },
  "name": "DD+ ATMOS",
  "includeCustomFormatWhenRenaming": false,
  "specifications": [
    {
      "name": "Dolby Digital Plus",
      "implementation": "ReleaseTitleSpecification",
      "negate": false,
      "required": true,
      "fields": {
        "value": "\\bDD[P+]|\\b(e[-_. ]?ac-?3)\\b"
      }
    },
    {
      "name": "ATMOS",
      "implementation": "ReleaseTitleSpecification",
      "negate": false,
      "required": true,
      "fields": {
        "value": "\\b(ATMOS|DDPA)(\\b|\\d)"
      }
    },
    {
      "name": "Not TrueHD",
      "implementation": "ReleaseTitleSpecification",
      "negate": true,
      "required": true,
      "fields": {
        "value": "True[ .-]?HD"
      }
    },
    {
      "name": "Not DTS",
      "implementation": "ReleaseTitleSpecification",
      "negate": true,
      "required": true,
      "fields": {
        "value": "\\bDTS(\\b|\\d)"
      }
    },
    {
      "name": "Not Basic Dolby Digital ",
      "implementation": "ReleaseTitleSpecification",
      "negate": true,
      "required": true,
      "fields": {
        "value": "\\bDD[^a-z+]|(?<!e-)\\b(ac-?3)\\b"
      }
    },
    {
      "name": "Not FLAC",
      "implementation": "ReleaseTitleSpecification",
      "negate": true,
      "required": true,
      "fields": {
        "value": "\\bFLAC(\\b|\\d)"
      }
    },
    {
      "name": "Not AAC",
      "implementation": "ReleaseTitleSpecification",
      "negate": true,
      "required": true,
      "fields": {
        "value": "\\bAAC(\\b|\\d)"
      }
    },
    {
      "name": "Not PCM",
      "implementation": "ReleaseTitleSpecification",
      "negate": true,
      "required": true,
      "fields": {
        "value": "\\b(l?)PCM(\\b|\\d)"
      }
    }
  ]
}
