{
  "trash_id": "23297a736ca77c0fc8e70f8edd7ee56c",
  "trash_scores": {
    "default": -10000,
    "german": -35000,
    "german-anime": -35000
  },
  "trash_regex": "https://regex101.com/r/CISl2B/1",
  "name": "Upscaled",
  "includeCustomFormatWhenRenaming": false,
  "specifications": [
    {
      "name": "AI Upscales",
      "implementation": "ReleaseTitleSpecification",
      "negate": false,
      "required": false,
      "fields": {
        "value": "(?<=\\b\\d{3,4}p\\b)(?=.*\\b(HEVC)\\b)(?=.*\\b(AI)\\b)"
      }
    },
    {
      "name": "AIUS",
      "implementation": "ReleaseTitleSpecification",
      "negate": false,
      "required": false,
      "fields": {
        "value": "\\b(AIUS)\\b"
      }
    },
    {
      "name": "Regrade",
      "implementation": "ReleaseTitleSpecification",
      "negate": false,
      "required": false,
      "fields": {
        "value": "\\b((Upscale)?Re-?graded?)\\b"
      }
    },
    {
      "name": "RW",
      "implementation": "ReleaseTitleSpecification",
      "negate": false,
      "required": false,
      "fields": {
        "value": "\\b(RW)\\b"
      }
    },
    {
      "name": "TheUpscaler",
      "implementation": "ReleaseTitleSpecification",
      "negate": false,
      "required": false,
      "fields": {
        "value": "\\b(The[ ._-]?Upscaler)\\b"
      }
    },
    {
      "name": "Upscaled",
      "implementation": "ReleaseTitleSpecification",
      "negate": false,
      "required": false,
      "fields": {
        "value": "(?<=\\b\\d{3,4}p\\b).*\\b(AI[ ._-]?(Enhanced?|Remaster(ed)?)|UPS(UHD)?|Upscaled?([ ._-]?UHD)?|UpRez)\\b"
      }
    }
  ]
}
