{
  "trash_id": "c30d2958827d1867c73318a5a2957eb1",
  "trash_scores": {
    "default": 50
  },
  "trash_regex": "https://regex101.com/r/GfOSFe/1",
  "name": "RED",
  "includeCustomFormatWhenRenaming": true,
  "specifications": [
    {
      "name": "YouTube Red",
      "implementation": "ReleaseTitleSpecification",
      "negate": false,
      "required": false,
      "fields": {
        "value": "\\b(red|youtube red)\\b[ ._-]web[ ._-]?(dl|rip)?\\b"
      }
    },
    {
      "name": "RED Rename",
      "implementation": "ReleaseTitleSpecification",
      "negate": false,
      "required": false,
      "fields": {
        "value": "\\[(RED)\\b|\\b(RED)\\]"
      }
    },
    {
      "name": "WEBDL",
      "implementation": "SourceSpecification",
      "negate": false,
      "required": false,
      "fields": {
        "value": 3
      }
    },
    {
      "name": "WEBRIP",
      "implementation": "SourceSpecification",
      "negate": false,
      "required": false,
      "fields": {
        "value": 4
      }
    }
  ]
}
