{
  "trash_id": "bf40cabd88c0025b03ad511d300d7394",
  "trash_scores": {
    "default": 1700
  },
  "name": "German Anime Scene",
  "includeCustomFormatWhenRenaming": false,
  "specifications": [
    {
      "name": "ONiGiRi",
      "implementation": "ReleaseGroupSpecification",
      "negate": false,
      "required": false,
      "fields": {
        "value": "^(ONiGiRi)$"
      }
    },
    {
      "name": "STARS",
      "implementation": "ReleaseGroupSpecification",
      "negate": false,
      "required": false,
      "fields": {
        "value": "^(STARS)$"
      }
    },
    {
      "name": "PHM",
      "implementation": "ReleaseGroupSpecification",
      "negate": false,
      "required": false,
      "fields": {
        "value": "^(PHM)$"
      }
    }
  ]
}
