{
  "trash_id": "9c11cd3f07101cdba90a2d81cf0e56b4",
  "trash_scores": {
    "default": -10000,
    "german": -35000,
    "german-anime": -35000
  },
  "name": "LQ",
  "includeCustomFormatWhenRenaming": false,
  "specifications": [
    {
      "name": "126811",
      "implementation": "ReleaseGroupSpecification",
      "negate": false,
      "required": false,
      "fields": {
        "value": "^(126811)$"
      }
    },
    {
      "name": "BRiNK",
      "implementation": "ReleaseGroupSpecification",
      "negate": false,
      "required": false,
      "fields": {
        "value": "^(BRiNK)$"
      }
    },
    {
      "name": "BTM",
      "implementation": "ReleaseGroupSpecification",
      "negate": false,
      "required": false,
      "fields": {
        "value": "^(BTM)$"
      }
    },
    {
      "name": "CHX",
      "implementation": "ReleaseGroupSpecification",
      "negate": false,
      "required": false,
      "fields": {
        "value": "^(CHX)$"
      }
    },
    {
      "name": "CTFOH",
      "implementation": "ReleaseGroupSpecification",
      "negate": false,
      "required": false,
      "fields": {
        "value": "^(CTFOH)$"
      }
    },
    {
      "name": "d3g",
      "implementation": "ReleaseGroupSpecification",
      "negate": false,
      "required": false,
      "fields": {
        "value": "^(d3g)$"
      }
    },
    {
      "name": "DepraveD",
      "implementation": "ReleaseGroupSpecification",
      "negate": false,
      "required": false,
      "fields": {
        "value": "^(DepraveD)$"
      }
    },
    {
      "name": "EVO",
      "implementation": "ReleaseGroupSpecification",
      "negate": false,
      "required": false,
      "fields": {
        "value": "^(EVO)$"
      }
    },
    {
      "name": "Feranki1980",
      "implementation": "ReleaseGroupSpecification",
      "negate": false,
      "required": false,
      "fields": {
        "value": "^(Feranki1980)$"
      }
    },
    {
      "name": "FGT",
      "implementation": "ReleaseGroupSpecification",
      "negate": false,
      "required": false,
      "fields": {
        "value": "^(FGT)$"
      }
    },
    {
      "name": "FMD",
      "implementation": "ReleaseGroupSpecification",
      "negate": false,
      "required": false,
      "fields": {
        "value": "^(FMD)$"
      }
    },
    {
      "name": "GHOSTS",
      "implementation": "ReleaseGroupSpecification",
      "negate": false,
      "required": false,
      "fields": {
        "value": "^(GHOSTS)$"
      }
    },
    {
      "name": "HiQVE",
      "implementation": "ReleaseGroupSpecification",
      "negate": false,
      "required": false,
      "fields": {
        "value": "^(HiQVE)$"
      }
    },
    {
      "name": "iNTENSO",
      "implementation": "ReleaseGroupSpecification",
      "negate": false,
      "required": false,
      "fields": {
        "value": "^(iNTENSO)$"
      }
    },
    {
      "name": "iVy",
      "implementation": "ReleaseGroupSpecification",
      "negate": false,
      "required": false,
      "fields": {
        "value": "^(iVy)$"
      }
    },
    {
      "name": "JFF",
      "implementation": "ReleaseGroupSpecification",
      "negate": false,
      "required": false,
      "fields": {
        "value": "^(JFF)$"
      }
    },
    {
      "name": "KC",
      "implementation": "ReleaseGroupSpecification",
      "negate": false,
      "required": false,
      "fields": {
        "value": "^(KC)$"
      }
    },
    {
      "name": "MeGusta",
      "implementation": "ReleaseGroupSpecification",
      "negate": false,
      "required": false,
      "fields": {
        "value": "^(MeGusta)$"
      }
    },
    {
      "name": "nhanc3",
      "implementation": "ReleaseGroupSpecification",
      "negate": false,
      "required": false,
      "fields": {
        "value": "^(nhanc3)$"
      }
    },
    {
      "name": "OFT",
      "implementation": "ReleaseGroupSpecification",
      "negate": false,
      "required": false,
      "fields": {
        "value": "^(OFT)$"
      }
    },
    {
      "name": "Pahe",
      "implementation": "ReleaseGroupSpecification",
      "negate": false,
      "required": false,
      "fields": {
        "value": "Pahe(\\.(ph|in))?\\b"
      }
    },
    {
      "name": "PSA",
      "implementation": "ReleaseGroupSpecification",
      "negate": false,
      "required": false,
      "fields": {
        "value": "^(PSA)$"
      }
    },
    {
      "name": "SasukeducK",
      "implementation": "ReleaseGroupSpecification",
      "negate": false,
      "required": false,
      "fields": {
        "value": "^(SasukeducK)$"
      }
    },
    {
      "name": "SHD",
      "implementation": "ReleaseGroupSpecification",
      "negate": false,
      "required": false,
      "fields": {
        "value": "^(SHD)$"
      }
    },
    {
      "name": "ShieldBearer",
      "implementation": "ReleaseGroupSpecification",
      "negate": false,
      "required": false,
      "fields": {
        "value": "^(ShieldBearer)$"
      }
    },
    {
      "name": "TBS",
      "implementation": "ReleaseGroupSpecification",
      "negate": false,
      "required": false,
      "fields": {
        "value": "^(TBS)$"
      }
    },
    {
      "name": "TG",
      "implementation": "ReleaseGroupSpecification",
      "negate": false,
      "required": false,
      "fields": {
        "value": "^(TG)$"
      }
    },
    {
      "name": "VIDEOHOLE",
      "implementation": "ReleaseGroupSpecification",
      "negate": false,
      "required": false,
      "fields": {
        "value": "^(VIDEOHOLE)$"
      }
    },
    {
      "name": "worldmkv",
      "implementation": "ReleaseGroupSpecification",
      "negate": false,
      "required": false,
      "fields": {
        "value": "^(worldmkv)$"
      }
    },
    {
      "name": "XLF",
      "implementation": "ReleaseGroupSpecification",
      "negate": false,
      "required": false,
      "fields": {
        "value": "^(XLF)$"
      }
    },
    {
      "name": "Zero00",
      "implementation": "ReleaseGroupSpecification",
      "negate": false,
      "required": false,
      "fields": {
        "value": "^(Zero00)$"
      }
    }
  ]
}
