{
  "trash_id": "133589380b89f8f8394320901529bac1",
  "trash_scores": {
      "default": -20000
  },
  "name": "Not German or English",
  "includeCustomFormatWhenRenaming": false,
  "specifications": [
    {
      "name": "Not English Language",
      "implementation": "LanguageSpecification",
      "negate": true,
      "required": true,
      "fields": {
        "value": 1
      }
    },
    {
      "name": "Not German Language",
      "implementation": "LanguageSpecification",
      "negate": true,
      "required": true,
      "fields": {
        "value": 4
      }
    },
    {
      "name": "Not German in Title",
      "implementation": "ReleaseTitleSpecification",
      "negate": true,
      "required": true,
      "fields": {
        "value": "(?i)\\bgerman\\b"
      }
    }
  ]
}
