{
  "trash_id": "417804f7f2c4308c1f4c5d380d4c4475",
  "trash_scores": {
    "default": 3000,
    "sqp-1-1080p": 0,
    "sqp-1-web-1080p": 0,
    "sqp-1-2160p": 0,
    "sqp-1-web-2160p": 0,
    "sqp-4-ma-hybrid": 480
  },
  "name": "ATMOS (undefined)",
  "includeCustomFormatWhenRenaming": false,
  "specifications": [
    {
      "name": "ATMOS",
      "implementation": "ReleaseTitleSpecification",
      "negate": false,
      "required": true,
      "fields": {
        "value": "\\bATMOS(\\b|\\d)"
      }
    },
    {
      "name": "Not AAC",
      "implementation": "ReleaseTitleSpecification",
      "negate": true,
      "required": true,
      "fields": {
        "value": "\\bAAC(\\b|\\d)"
      }
    },
    {
      "name": "Not Basic Dolby Digital ",
      "implementation": "ReleaseTitleSpecification",
      "negate": true,
      "required": true,
      "fields": {
        "value": "\\bDD[^a-z+]|(?<!e-)\\b(ac-?3)\\b"
      }
    },
    {
      "name": "Not Dolby Digital Plus",
      "implementation": "ReleaseTitleSpecification",
      "negate": true,
      "required": true,
      "fields": {
        "value": "\\bDD[P+]|\\b(e[-_. ]?ac-?3)\\b"
      }
    },
    {
      "name": "Not DTS",
      "implementation": "ReleaseTitleSpecification",
      "negate": true,
      "required": true,
      "fields": {
        "value": "\\bDTS(\\b|\\d)"
      }
    },
    {
      "name": "Not FLAC",
      "implementation": "ReleaseTitleSpecification",
      "negate": true,
      "required": true,
      "fields": {
        "value": "\\bFLAC(\\b|\\d)"
      }
    },
    {
      "name": "Not PCM",
      "implementation": "ReleaseTitleSpecification",
      "negate": true,
      "required": true,
      "fields": {
        "value": "\\b(l?)PCM(\\b|\\d)"
      }
    },
    {
      "name": "Not RlsGrp (Atmos Only)",
      "implementation": "ReleaseTitleSpecification",
      "negate": true,
      "required": true,
      "fields": {
        "value": "\\b(W4NK3R|HQMUX)\\b"
      }
    },
    {
      "name": "Not TrueHD",
      "implementation": "ReleaseTitleSpecification",
      "negate": true,
      "required": true,
      "fields": {
        "value": "True[ .-]?HD"
      }
    }
  ]
}
