{
  "trash_id": "language-prefer-spanish",
  "trash_scores": {
    "default": 10
  },
  "trash_description": "Prefer Language X",
  "name": "Spanish",
  "includeCustomFormatWhenRenaming": false,
  "specifications": [
    {
      "name": "Spanish Language",
      "implementation": "LanguageSpecification",
      "negate": false,
      "required": false,
      "fields": {
        "value": 3
      }
    }
  ]
}