{
  "trash_id": "5763d1b0ce84aff3b21038eea8e9b8ad",
  "name": "HMAX",
  "includeCustomFormatWhenRenaming": true,
  "specifications": [
    {
      "name": "HBO Max",
      "implementation": "ReleaseTitleSpecification",
      "negate": false,
      "required": true,
      "fields": {
        "value": "\\b(hmax|hbom|HBO Max)\\b"
      }
    },
    {
      "name": "WEBDL",
      "implementation": "SourceSpecification",
      "negate": false,
      "required": false,
      "fields": {
        "value": 7
      }
    },
    {
      "name": "WEBRIP",
      "implementation": "SourceSpecification",
      "negate": false,
      "required": false,
      "fields": {
        "value": 8
      }
    }
  ]
}
