{
  "trash_id": "fb1a91cdc0f26f7ca0696e0e95274645",
  "trash_scores": {
    "default": 50
  },
  "trash_regex": "https://regex101.com/r/hWHpjV/1",
  "name": "OViD",
  "includeCustomFormatWhenRenaming": true,
  "specifications": [
    {
      "name": "OViD",
      "implementation": "ReleaseTitleSpecification",
      "negate": false,
      "required": true,
      "fields": {
        "value": "\\b(ovid)\\b"
      }
    },
    {
      "name": "WEBDL",
      "implementation": "SourceSpecification",
      "negate": false,
      "required": false,
      "fields": {
        "value": 3
      }
    },
    {
      "name": "WEBRIP",
      "implementation": "SourceSpecification",
      "negate": false,
      "required": false,
      "fields": {
        "value": 4
      }
    }
  ]
}
