{
  "trash_id": "f2aacebe2c932337fe352fa6e42c1611",
  "name": "9.1 Surround",
  "includeCustomFormatWhenRenaming": false,
  "specifications": [{
          "name": "9.1  Surround",
          "implementation": "ReleaseTitleSpecification",
          "negate": false,
          "required": true,
          "fields": {
              "value": "[^0-9]9[ .][0-1]"
          }
      },
      {
          "name": "Not 7.1 Surround",
          "implementation": "ReleaseTitleSpecification",
          "negate": true,
          "required": true,
          "fields": {
              "value": "[^0-9][7-8][ .][0-1]"
          }
      },
      {
          "name": "Not 5.1 Surround",
          "implementation": "ReleaseTitleSpecification",
          "negate": true,
          "required": true,
          "fields": {
              "value": "[^0-9][5-6][ .][0-1]"
          }
      },
      {
          "name": "Not Low Channel Count",
          "implementation": "ReleaseTitleSpecification",
          "negate": true,
          "required": true,
          "fields": {
              "value": "(?<!repac)[^0-9][1-4][ .][0-1]|\\b(Stereo|Mono)\\b"
          }
      }
  ]
}
