{
  "trash_id": "d9058beaae2e147183870304dd526761",
  "name": "CBC",
  "includeCustomFormatWhenRenaming": true,
  "specifications": [
    {
      "name": "CBC",
      "implementation": "ReleaseTitleSpecification",
      "negate": false,
      "required": true,
      "fields": {
        "value": "\\b(CBC)\\b"
      }
    },
    {
      "name": "WEBDL",
      "implementation": "SourceSpecification",
      "negate": false,
      "required": false,
      "fields": {
        "value": 7
      }
    },
    {
      "name": "WEBRIP",
      "implementation": "SourceSpecification",
      "negate": false,
      "required": false,
      "fields": {
        "value": 8
      }
    }
  ]
}
