{
  "trash_id": "9f72dc1059a6b277c21cee6a1f15f13f",
  "trash_scores": {
    "default": 50
  },
  "name": "MY5",
  "includeCustomFormatWhenRenaming": true,
  "specifications": [
    {
      "name": "MY5",
      "implementation": "ReleaseTitleSpecification",
      "negate": false,
      "required": true,
      "fields": {
        "value": "\\b(my5)\\b[ ._-]web[ ._-]?(dl|rip)?\\b"
      }
    },
    {
      "name": "WEBDL",
      "implementation": "SourceSpecification",
      "negate": false,
      "required": false,
      "fields": {
        "value": 3
      }
    },
    {
      "name": "WEBRIP",
      "implementation": "SourceSpecification",
      "negate": false,
      "required": false,
      "fields": {
        "value": 4
      }
    }
  ]
}
