{
  "trash_id": "d17ea3d84c15299474b76fe85aa02a26",
  "trash_scores": {
    "default": 50
  },
  "name": "CPNG",
  "includeCustomFormatWhenRenaming": true,
  "specifications": [
    {
      "name": "CPNG",
      "implementation": "ReleaseTitleSpecification",
      "negate": false,
      "required": true,
      "fields": {
        "value": "\\b(CPNG)\\b"
      }
    },
    {
      "name": "WEBDL",
      "implementation": "SourceSpecification",
      "negate": false,
      "required": false,
      "fields": {
        "value": 3
      }
    },
    {
      "name": "WEBRIP",
      "implementation": "SourceSpecification",
      "negate": false,
      "required": false,
      "fields": {
        "value": 4
      }
    }
  ]
}
